{
  "state_contract_version": "2.0",
  "state_id": "state.gamelift-capacity-autonomy",
  "state_revision": 7,
  "policy": {
    "policy_id": "policy.gamelift-capacity-autonomy",
    "policy_version": "2026-09-01",
    "policy_hash": "sha256:7237ef5829513a408b309343ae4117756f46e69574adca3931b83450c9b74b18"
  },
  "tenant_id": "tenant.default",
  "workspace_id": "workspace.default",
  "resource_enrollment": {
    "enrollment_id": "enroll.fleet-default",
    "enrollment_version": "2026-09-01"
  },
  "target": {
    "provider": "gamelift",
    "fleet_id": "fleet-1234abcd-5678-90ef-a1b2-c3d4e5f60789",
    "location": "us-west-2"
  },
  "as_of_epoch_seconds": 1790017972,
  "expires_at_epoch_seconds": 1790018032,
  "last_write_epoch_seconds": null,
  "writes_in_window": 0,
  "window_micro_usd": 0,
  "action_micro_usd": 100000,
  "in_flight": 0,
  "last_change_direction": "none",
  "direction_flips_in_window": 0,
  "state_hash": "sha256:b037022bc46ad00af71d23765a1dfedcad6cb2c896cb0b8c55e87ef8721b0339"
}
